Intent Display Name,Language,Phrase
top_up_reverted,en,"what did you do with my money??? i just topped up, i saw the money was there, but now it's gone!! what did you do with it?"
top_up_reverted,en,"i thought crypto top up with something you offer. this is not working. the money has been deducted from my account. can you find out what's going on?"
top_up_reverted,en,"i tried to add a topup to my account but the money isn't there, anymore. did i do something wrong?"
top_up_reverted,en,"i put some money in my account the other day but now its gone? why is this?"
top_up_reverted,en,"my top-up was supposed to be done, but now the money is gone! is there a glitch in your system?"
topping_up_by_card,en,"my top up is not showing up in my wallet!"
topping_up_by_card,en,"i tried to top off using the card, but the money just disappeared?"
topping_up_by_card,en,"i can not see my top up"
topping_up_by_card,en,"why was my card charged when topping off my balance but it's not showing up in my wallet balance?"
topping_up_by_card,en,"is it possible to top up by card?"
topping_up_by_card,en,"i tried to get gas but my money was gone!"
topping_up_by_card,en,"am i the only one who can top-up my account?"
topping_up_by_card,en,"i have a new card. how do i top it up?"
topping_up_by_card,en,"is it possible to transfer money to my credit card?"
topping_up_by_card,en,"i attempted to top up using my card, but now the money just disappeared?"
transaction_charged_twice,en,"there were two of the same charge to my account"
transaction_charged_twice,en,"looks like my card payment was made twice by mistake. i paid at the store earlier which rejected once, second time it worked. app stays at pending for one of the payments. can you please remove one of them as it's wrong and clearly was declined?"
transaction_charged_twice,en,"i have two of the same charges on my account!"
transaction_charged_twice,en,"hi, i was just checking over my card transactions and notice i was charged twice for a restaurant visit this week. can you please remove one of these false charges from my account?"
transaction_charged_twice,en,"transaction showing up many times."
transaction_charged_twice,en,"there are two of the same charge on my statement."
transaction_charged_twice,en,"i was charged twice for an in-store purchase that i thought was declined.  my app says that it's still pending for one of the payments. please make sure one of the charges is removed."
transaction_charged_twice,en,"i have been overcharged."
transaction_charged_twice,en,"hi, i was at a restaurant later the week and when i went to look at my account i noticed that i got charged twice. i would like to get my money back from one of those transactions."
transaction_charged_twice,en,"i was charged several times for something"
transfer_fee_charged,en,"why am i seeing a transfer fee on my bank statement?"
transfer_fee_charged,en,"why were there additional charges when i transferred funds?"
transfer_fee_charged,en,"i use my card internationally to manage payments and i just noticed that you are adding additional fees.  why?  i am a good customer and this has me thinking about leaving."
transfer_fee_charged,en,"when i was transferring money i was charged extra why?"
transfer_fee_charged,en,"i see a transfer fee, but to my understand, that should have been free, what happened?"
transfer_fee_charged,en,"how come a fee was charged when i tranferred money"
transfer_fee_charged,en,"why is there a fee for my transfer?"
transfer_fee_charged,en,"i did a transfer and was charged a fee that should not have been charged!"
transfer_fee_charged,en,"i need to know how much it costs to transfer funds."
transfer_fee_charged,en,"after a transfer, i see an extra fee.  why?"
transfer_into_account,en,"how do i transfer money into my account?"
transfer_into_account,en,"i need to transfer money into my account, and i don't know how to do that."
transfer_into_account,en,"how do i transfer cash my into my account?"
transfer_into_account,en,"help! my account doesn't show any funds. is transferring funds an option i can use?"
transfer_into_account,en,"where can i find out how to transfer money into my account."
transfer_into_account,en,"how do i transfer money between two of my accounts?"
transfer_into_account,en,"how can i add money to my account from another account i have?"
transfer_into_account,en,"how can i top up my account by bank transfer?"
transfer_into_account,en,"i want to transfer a sum of money from another bank account i have into this one"
transfer_into_account,en,"i need to know the process to transfer money into my account."
transfer_not_received_by_recipient,en,"why can't the person i sent the money transfer to see it?"
transfer_not_received_by_recipient,en,"i payed my rent to my landlord a few days ago and he is saying the it never went though. everything looks good to me and i even double checked the account number. i don't know what could be causing the confusion. can you help me please?"
transfer_not_received_by_recipient,en,"why is my friend not getting a transaction arrival yet?"
transfer_not_received_by_recipient,en,"a transaction to a friend still hasn't shown up."
transfer_not_received_by_recipient,en,"when will i get my money? it's been too long."
transfer_not_received_by_recipient,en,"my cash transaction isn't showing on my account"
transfer_not_received_by_recipient,en,"what do i do if i completed a money transfer but the recipient hasn't received it?"
transfer_not_received_by_recipient,en,"hi - i have made a transaction to my new landlord but unfortunately it shows on my end but not on the landlord's end. the numbers are correct. can you confirm when that will go through?"
transfer_not_received_by_recipient,en,"i sent money to someone but they haven't gotten it, what's going on?"
transfer_not_received_by_recipient,en,"why has a transaction to a friend been delayed?"
transfer_timing,en,"how long is the transfer?"
transfer_timing,en,"help! i need to transfer something to china."
transfer_timing,en,"what is the estimated time on an urgent transfer from china?"
transfer_timing,en,"how long will it take for the money to reach my account?"
transfer_timing,en,"when will the money from a transfer be made available on my account?"
transfer_timing,en,"how long until the transfer is reflected on my account balance?"
transfer_timing,en,"how long does it take transfers from europe to complete?"
transfer_timing,en,"when can i expect the transfer to arrive in my account?"
transfer_timing,en,"how long will i have to wait for my money to be in my account?"
transfer_timing,en,"i have a transfer from the us, how long is the wait?"
unable_to_verify_identity,en,"if you are waiting for verification, it can take 10 minutes to 60 minutes to get results.you will hear from us once we have it.  please make sure your images are clear and photos of documents are readable. you have to be at least 18 years old and live withing the economic area of europe or in switzerland in order to open an account."
unable_to_verify_identity,en,"i can't upload my identification."
unable_to_verify_identity,en,"i have trouble proving my identity."
unable_to_verify_identity,en,"i dont have identification"
unable_to_verify_identity,en,"my identity isn't being accepted, what should i do?"
unable_to_verify_identity,en,"my identity can't be verified."
unable_to_verify_identity,en,"what do i need to bring for identification?"
unable_to_verify_identity,en,"i am not recognized by the app."
unable_to_verify_identity,en,"i am having trouble verifying my id."
unable_to_verify_identity,en,"why hasn't my id been verified?"
verify_my_identity,en,"what do i need for the verification check?"
verify_my_identity,en,"which documents do i need for this identity check?"
verify_my_identity,en,"how can i prove who i am?"
verify_my_identity,en,"for the identity check, what kind of documents do i need to have?"
verify_my_identity,en,"how can i prove i am me?"
verify_my_identity,en,"how do i verify my identity online"
verify_my_identity,en,"how do i change my identity?"
verify_my_identity,en,"hi! what documents can i use to verify my identity?"
verify_my_identity,en,"what is needed for the identity verification?"
verify_my_identity,en,"how do i perform identity checks?"
verify_source_of_funds,en,"where did my money come from?"
verify_source_of_funds,en,"why do i need to verify my funds?"
verify_source_of_funds,en,"can i see the source of my available money?"
verify_source_of_funds,en,"how can i lookup the source for my available money?"
verify_source_of_funds,en,"how can i look at where my available cash is coming from?"
verify_source_of_funds,en,"please explain to me how to know where my funds are from."
verify_source_of_funds,en,"is there a way for me to check my balance?"
verify_source_of_funds,en,"i require verification of my source of funds."
verify_source_of_funds,en,"how can i receive verification for the source of my funds?"
verify_source_of_funds,en,"i need to see where my money came from."
verify_top_up,en,"i need to find the top up verification code"
verify_top_up,en,"i have a top up card. where is the verification code?"
verify_top_up,en,"tell me how to verify a top up."
verify_top_up,en,"why do you verify the top up"
verify_top_up,en,"this verifying the top up is annoying"
verify_top_up,en,"how do i verify the top-up card?"
verify_top_up,en,"where is the top-up verification code located?"
verify_top_up,en,"is there a reason why top-up needs verifying?"
verify_top_up,en,"where do i verify a top-up card?"
verify_top_up,en,"how do i find the code to verify the top up card?"
virtual_card_not_working,en,"i tried paying with my disposable virtual card earlier but it was rejected. what can i do to fix this?"
virtual_card_not_working,en,"my disposable virtual card got rejected"
virtual_card_not_working,en,"i can't make purchases with my virtual card."
virtual_card_not_working,en,"my throwaway virtual card won't work"
virtual_card_not_working,en,"my virtual car is not working."
virtual_card_not_working,en,"why won't my virtual card work?"
virtual_card_not_working,en,"i have a disposable card but it does not work?"
virtual_card_not_working,en,"is there a reason why my virtual card won't work?"
virtual_card_not_working,en,"can i use my virtual card for recurring monthly payments?"
virtual_card_not_working,en,"i can't get my virtual card to work at all"
visa_or_mastercard,en,"visa or mastercard?"
visa_or_mastercard,en,"can i choose between visa or mastercard?"
visa_or_mastercard,en,"is it ok if i use both visa and mastercard"
visa_or_mastercard,en,"how do i get selected for a visa card?"
visa_or_mastercard,en,"do i have an option between visa and mastercard?"
visa_or_mastercard,en,"can i get a visa from you?"
visa_or_mastercard,en,"is it possible to get both mastercard and visa card from you?"
visa_or_mastercard,en,"do you accept visa or mastercard?"
visa_or_mastercard,en,"please give me a mastercard instead."
visa_or_mastercard,en,"can i use both visa and mastercard"
why_verify_identity,en,"why and how soon do i have to have proof of identity to you?"
why_verify_identity,en,"why do you need so much id info from me?"
why_verify_identity,en,"what are the reasons i have to proof my identity to you?"
why_verify_identity,en,"why is there an identity check?"
why_verify_identity,en,"i'm waiting for the id verification to go through still, so is it too soon to use my account?"
why_verify_identity,en,"am i supposed to verify my identity?"
why_verify_identity,en,"why do you have an identity check?"
why_verify_identity,en,"can i use my account before the identity verification is complete?"
why_verify_identity,en,"why check my identity?"
why_verify_identity,en,"is the identity check part of bank policy?"
wrong_amount_of_cash_received,en,"i only got $20 of the $100 that i attempted to withdraw."
wrong_amount_of_cash_received,en,"i tried to withdraw $100, all it gave me was $20."
wrong_amount_of_cash_received,en,"hey i am standing in front of an atm here, it only gave me 10 pounds even though i wanted to withdraw 30! seems like the app has 30 pounds, what do i do??"
wrong_amount_of_cash_received,en,"i visited the atm but got less money than what i requested. why?"
wrong_amount_of_cash_received,en,"i think something went wrong, i didn't get the right amount."
wrong_amount_of_cash_received,en,"$20 came out instead of $100"
wrong_amount_of_cash_received,en,"the atm didn't give me the amount i asked for"
wrong_amount_of_cash_received,en,"did a wd earlier at an atm.  the amount showing in the app is more than i got though."
wrong_amount_of_cash_received,en,"i am at the atm and tried to withdraw 30 pounds and it only gave me 10 pounds, what do i do?"
wrong_amount_of_cash_received,en,"how can i request cash back? the atm gave me the wrong amount that i've been charged though..."
wrong_exchange_rate_for_cash_withdrawal,en,"i tried using a foreign currency at an atm, but the atm provided me an incorrect rate. why is that?"
wrong_exchange_rate_for_cash_withdrawal,en,"foreign currency rates were put in wrong at an atm i used."
wrong_exchange_rate_for_cash_withdrawal,en,"when i got cash i believe that the exchange rate was wrong"
wrong_exchange_rate_for_cash_withdrawal,en,"i think that there was an error in calculating the exchange rate.  i recently withdrew cash and received much less than expected."
wrong_exchange_rate_for_cash_withdrawal,en,"what is the correct exchange rate for getting cash"
wrong_exchange_rate_for_cash_withdrawal,en,"why did you give me so little currency?"
wrong_exchange_rate_for_cash_withdrawal,en,"i didn't receive the correct exchange rate when i got cash."
wrong_exchange_rate_for_cash_withdrawal,en,"you've incorrectly calculated the exchange rate for my cash withdrawal"
wrong_exchange_rate_for_cash_withdrawal,en,"can i make a withdraw in my home currency at an atm? i'm on vacation and am a bit worried because i don't have cash with me. is it possible to withdraw here without any additional costs or fees?"
wrong_exchange_rate_for_cash_withdrawal,en,"when i got cash, the exchange rate applied was wrong."
