Intent Display Name,Language,Phrase
direct_debit_payment_not_recognised,en,"i just noticed that i supposedly made a payment to a seller a while back. the problem is, i don't recognize the seller. there must be a way to see who it is or track the payment. can you do that, because i don't remember this transaction?"
direct_debit_payment_not_recognised,en,"the app is showing a direct debit payment that i never made"
direct_debit_payment_not_recognised,en,"there is a payment showing on my app that i didn't do. will you please cancel this payment and refund my money ?"
direct_debit_payment_not_recognised,en,"why am i seeing a direct debit thats not mine?"
disposable_card_limits,en,"how many transactions can i make on my disposable card?"
disposable_card_limits,en,"what are the restrictions on the virtual cards?"
disposable_card_limits,en,"am i limited on the amount of disposable cards i can possess?"
disposable_card_limits,en,"where can i use a disposable card?"
disposable_card_limits,en,"what are the disposable virtual card limits?"
disposable_card_limits,en,"is there a transaction limit for a disposable card?"
disposable_card_limits,en,"i need multiple cards per day, and they all have to be disposable."
disposable_card_limits,en,"what are the policies of disposable cards?"
disposable_card_limits,en,"is there a limit to the number of disposable cards per day?"
disposable_card_limits,en,"whats the maximum number of disposable cards that i can get?"
edit_personal_details,en,"how to edit personal details?"
edit_personal_details,en,"i need to change details about my personal account."
edit_personal_details,en,"i've just moved and i need to change my details"
edit_personal_details,en,"i would like to change my adress"
edit_personal_details,en,"please tell me where i can update my details since i moved."
edit_personal_details,en,"how can i update my personal information after moving?"
edit_personal_details,en,"my address is incorrect on my file."
edit_personal_details,en,"my identity hasn't been verified and i can't edit my details, what's next"
edit_personal_details,en,"need my details changed"
edit_personal_details,en,"how would i change my details?"
exchange_charge,en,"what is the fee for a foreign currency exchange?"
exchange_charge,en,"what is the cost for exchanging currencies?"
exchange_charge,en,"will i have to pay extra to exchange money?"
exchange_charge,en,"does it cost anything to do currency exchanges?"
exchange_charge,en,"what is the rate for exchange fees?"
exchange_charge,en,"are currency exchanges free?"
exchange_charge,en,"when exchanging currencies, is there an extra fee?"
exchange_charge,en,"what commission do you take for currency exchage?"
exchange_charge,en,"can you tell me what the exchange fee is?"
exchange_charge,en,"can i be charged for exchanging foreign currency?"
exchange_rate,en,"how will i know what the exchange rate is?"
exchange_rate,en,"what is your opinion on the exchange rate?"
exchange_rate,en,"how do you decide what your exchange rates are?"
exchange_rate,en,"i want to know your exchange rates."
exchange_rate,en,"how do you calculate exchange rates?"
exchange_rate,en,"i'd like to know what the foreign exchange rate will be."
exchange_rate,en,"i need to know about exchange rates"
exchange_rate,en,"is there an exchange rate?"
exchange_rate,en,"what is the exchange looking like?"
exchange_rate,en,"what factors determine your exchange rate?"
exchange_via_app,en,"i need australian dollars instead of uk currency."
exchange_via_app,en,"can this app exchange american and english currency?"
exchange_via_app,en,"can i add a new currency to my account?"
exchange_via_app,en,"can i use your app to exchange between usd and gbp"
exchange_via_app,en,"how do i exchange currencies using the app?"
exchange_via_app,en,"i might need to exchange between usd and gbp, is this possible with your app?"
exchange_via_app,en,"i do not need gbp, i need aud, how do i convert it?"
exchange_via_app,en,"how can i change usd to gbp?"
exchange_via_app,en,"can i exchange currencies with the app?"
exchange_via_app,en,"can i use this app to change money?"
extra_charge_on_statement,en,"my statement shows an extra fee - what is it?"
extra_charge_on_statement,en,"hello, i see that i have been charged an extra $1 on my app.  could you please provide me with a reason for this charge?"
extra_charge_on_statement,en,"it appears i have a fee in my statement."
extra_charge_on_statement,en,"i've been charged an extra £1 and i don't know why"
extra_charge_on_statement,en,"can you tell me about why the account i have was charged an extra 1$"
extra_charge_on_statement,en,"i am seeing and extra 1$ charged to my account and wanted to know about it."
extra_charge_on_statement,en,"why is there a 1 euro fee on my statement?"
extra_charge_on_statement,en,"i was wrongfully charged one pound."
extra_charge_on_statement,en,"i got billed an extra pound!"
extra_charge_on_statement,en,"why is there an extra charge on my statement."
failed_transfer,en,"my transfer didn't work! help!"
failed_transfer,en,"my transfer did not work, what was the reason?"
failed_transfer,en,"did  my transfer fail?"
failed_transfer,en,"hi there, i've tried to make a transfer 5 different times and its not working. is your system down or something?"
failed_transfer,en,"can you please assist me in completing a transfer? i'm trying and i keep getting an error. i'm trying to purchase a flat and pay the initial mortgage payment. all i keep getting is an error. can you find out what's happening here?"
failed_transfer,en,"i can't transfer any money from my account to my friend's account, it keeps rejecting it. can you tell me why? i have enough funds in my account to transfer."
failed_transfer,en,"my transfer failed, why?"
failed_transfer,en,"please help my transfer go through"
failed_transfer,en,"i tried to transfer money but it didn't go through"
failed_transfer,en,"the attempted transfer failed."
fiat_currency_support,en,"is it okay to hold money in multiple currencies?"
fiat_currency_support,en,"which currencies are allowed?"
fiat_currency_support,en,"what are eligible holding and exchange currencies?"
fiat_currency_support,en,"can you tell me if i can hold money in several currencies?"
fiat_currency_support,en,"what currencies can my account be in?"
fiat_currency_support,en,"what fiat currencies do you support?"
fiat_currency_support,en,"what currencies do you support?"
fiat_currency_support,en,"is my country's currency supported by your system?"
fiat_currency_support,en,"what fiat currencies are supported?"
fiat_currency_support,en,"i want to have multiple currencies in my account if possible."
get_disposable_virtual_card,en,"please can i get a disposable virtual card as well?"
get_disposable_virtual_card,en,"what are these disposable cards meant for?"
get_disposable_virtual_card,en,"how do i get a disposable virtual card as well?"
get_disposable_virtual_card,en,"how can disposable cards be used?"
get_disposable_virtual_card,en,"where do i get a disposable card"
get_disposable_virtual_card,en,"how do i use disposable cards?"
get_disposable_virtual_card,en,"can you tell me about these disposable virtual cards?"
get_disposable_virtual_card,en,"can you tell me what are disposable cards for?"
get_disposable_virtual_card,en,"what are the disposable cards used for?"
get_disposable_virtual_card,en,"how does a disposable virtual card work?"
get_physical_card,en,"how do i set up my card pin?"
get_physical_card,en,"the card pin is not visible anywhere?"
get_physical_card,en,"where is my pin?"
get_physical_card,en,"how will i receive my pin?"
get_physical_card,en,"i cannot find my pin."
get_physical_card,en,"does the pin come under separate cover?"
get_physical_card,en,"i am yet to receive my pin."
get_physical_card,en,"i haven't received my pin yet. do i need to get it from you?"
get_physical_card,en,"where is the pin number found?"
get_physical_card,en,"how long do i wait for my pin"
getting_spare_card,en,"are extra cards free?"
getting_spare_card,en,"how can i get another card?"
getting_spare_card,en,"can i order a second card?"
getting_spare_card,en,"how can i create another card linked to this account?"
getting_spare_card,en,"my daughter would like a card from my account?  can i do this?"
getting_spare_card,en,"are there any fees to get additional cards?"
getting_spare_card,en,"can i get spare cards?"
getting_spare_card,en,"how do i receive more physical cards"
getting_spare_card,en,"can i have a duplicate second card?"
getting_spare_card,en,"how do i get another card"
getting_virtual_card,en,"why have i not yet received my virtual card?"
getting_virtual_card,en,"why haven't i been given a virtual card yet?"
getting_virtual_card,en,"where do i order a virtual card?"
getting_virtual_card,en,"i would like to order a virtual card, where can i get one?"
getting_virtual_card,en,"why have i not received a virtual card yet?"
getting_virtual_card,en,"are there virtual cards"
getting_virtual_card,en,"what do i have to do to get my virtual card?"
getting_virtual_card,en,"i have lost my card, but need to place an online order! how do i get a virtual card instantly?"
getting_virtual_card,en,"how can i go about ordering a virtual card?"
getting_virtual_card,en,"where can i find the virtual card?"
lost_or_stolen_card,en,"can you help me retrieve my card?"
lost_or_stolen_card,en,"can you tell me the status of my new card?"
lost_or_stolen_card,en,"what should i do?  my card has been stolen!"
lost_or_stolen_card,en,"hi, i am on vacation in spain and someone stole my bag with my phone and wallet with cards and everything. can you block it asap and then i want to order a new one also asap."
lost_or_stolen_card,en,"i lost my wallet and all my cards were in it."
lost_or_stolen_card,en,"i lost my card, what do i do now?"
lost_or_stolen_card,en,"my card was stolen"
lost_or_stolen_card,en,"my card is lost!  please help me!"
lost_or_stolen_card,en,"who can i speak with regarding a lost card?"
lost_or_stolen_card,en,"can you provide information for freezing my card immediately?"
lost_or_stolen_phone,en,"i can't use the app because i got mugged yesterday and they took everything. please help."
lost_or_stolen_phone,en,"what do i do to lock my phone after losing it so my account isn't accessed"
lost_or_stolen_phone,en,"i lost my phone.  what do i do to block someone else from using my account?"
lost_or_stolen_phone,en,"i cannot get to my app, what should i do?"
lost_or_stolen_phone,en,"i cannot find my phone, what should i do?"
lost_or_stolen_phone,en,"how do i use my card if i lost my phone?"
lost_or_stolen_phone,en,"my phone was taken yesterday, what should i do about my account?"
lost_or_stolen_phone,en,"i no longer have my phone, what should i do?"
lost_or_stolen_phone,en,"i left my phone somewhere and can't use the app."
lost_or_stolen_phone,en,"my cards were stolen"
order_physical_card,en,"is there a fee to get an actual card?"
order_physical_card,en,"what locations are cards delivered to?"
order_physical_card,en,"do i have to pay for a physical card?"
order_physical_card,en,"can i get an actual card"
order_physical_card,en,"is payment required to get a card of my own?"
order_physical_card,en,"where do you need to live to receive card"
order_physical_card,en,"i need to get a card, how do i do that?"
order_physical_card,en,"do i get an actual card?"
order_physical_card,en,"what is the cost for physical cards?"
order_physical_card,en,"do i get a card to keep in my wallet?"
passcode_forgotten,en,"what is my password?"
passcode_forgotten,en,"i am unaware of what my password is."
passcode_forgotten,en,"i need a new login code"
passcode_forgotten,en,"i need to reset my passcode. where do i go to do that?"
passcode_forgotten,en,"i forgot my password to get into the app!"
passcode_forgotten,en,"why doesn't my passcode work?"
passcode_forgotten,en,"i can't remember my app code, can you reset it?"
passcode_forgotten,en,"what are the steps for changing my passcode?"
passcode_forgotten,en,"can someone help with my passcode?"
passcode_forgotten,en,"i need to reset the passcode."
pending_card_payment,en,"my card payment says pending and it hasn't changed"
pending_card_payment,en,"hello, i made a payment with my card and it's not working. it's been a while and still says its pending. can you tell when this will go through?"
pending_card_payment,en,"i have a payment that is still pending"
pending_card_payment,en,"the payment on my card shows as pending."
pending_card_payment,en,"i made a payment but it's still pending"
pending_card_payment,en,"the purchase i made is still pending."
pending_card_payment,en,"why is my card payment pending?"
pending_card_payment,en,"what does it mean if it says that my payment is pending?"
pending_card_payment,en,"i need to find out why my pending payment hasn't gone through."
pending_card_payment,en,"why is my purchase showing as pending?"
pending_cash_withdrawal,en,"why would a cash withdrawal still be pending?"
pending_cash_withdrawal,en,"hi there, earlier today i tried to take money out of an atm machine, and something wasn't working.  i didn't actually receive the money, but i just checked and it says that the transaction is still pending.  can you tell me what's going on here? am i still being charged for the withdrawal even though i didn't end up getting any money?"
pending_cash_withdrawal,en,"hello, i have a pending transaction in my account due to an atm machine that wasn't working. in any case if the transaction goes through, after how long can i get my money back?"
pending_cash_withdrawal,en,"why is my withdrawal from the atm still showing as pending?"
pending_cash_withdrawal,en,"hello, i'm having trouble with my card, i don't understand what's happening, i tried using the atm machine earlier but it wasn't working but seems like the transactions is still in progress, can you cancel it for me?"
pending_cash_withdrawal,en,"i went to an atm to get cash, but the app says the withdrawal is still pending. how is that possible when i already have the cash with me?"
pending_cash_withdrawal,en,"hae there, i have a transaction that is in progress despite the fact that the atm was not working, what do i do to avoid being charged?"
pending_cash_withdrawal,en,"how long will my cash withdrawal be pending for?"
pending_cash_withdrawal,en,"i'm expecting to see a cash withdrawal but i'm still waiting."
pending_cash_withdrawal,en,"how long does it typically take for a pending atm withdrawal to clear?"
pending_top_up,en,"my top is still pending."
pending_top_up,en,"hello, i am a new customer, and just tried topping up for the first time. according to your information, the transaction should be instant - why does it still show as pending?"
pending_top_up,en,"what is the reason my top-up is still pending?"
pending_top_up,en,"when will my top-up go through?"
pending_top_up,en,"why is top up pending"
pending_top_up,en,"i made a top up yesterday but it's still pending."
pending_top_up,en,"i'm a new customer and tried topping up today for the first time. it's still pending and doesn't seem to be working. i need to get this fixed."
pending_top_up,en,"my top up is still pending"
pending_top_up,en,"why has my top up not gone through yet?"
pending_top_up,en,"i have been waiting for my top-up to complete and it still hasn't gone through."
pending_transfer,en,"can you tell me why my transfer is pending still?"
pending_transfer,en,"it seems like i have been waiting forever for this international transfer. why is it taking so long? c'mon, it's 2018, things happen at a click of a button. all of the account information is correct, so how long will this take?"
pending_transfer,en,"why is my transfer appearing as "pending"?"
pending_transfer,en,"i didn't think my country-to-country money transfer would take so long. it still says that it's pending so i re-checked all of the account information--everything seems right, so what's the deal?"
pending_transfer,en,"could you please help me figure out why the seller has not received their money after i sent it."
pending_transfer,en,"i have an outgoing transfer"
pending_transfer,en,"hello. how long does it usually take to transfer money to another country? i've made sure all the information is correct, but the transfer still says that it's "pending.""
pending_transfer,en,"what is the reason a transfer shows as pending?"
pending_transfer,en,"the transfer was accepted but now it's stuck on pending. when will it go through?"
pending_transfer,en,"how long will my transfer stay pending?"
pin_blocked,en,"can you unblock my blocked pin?"
pin_blocked,en,"will you help me unblock my pin after putting in the wrong pin too many times?"
pin_blocked,en,"i forgot my pin and am blocked now. can i reset it somewhere?"
pin_blocked,en,"how come i got blocked for entering wrong pins?"
pin_blocked,en,"what do i do if my pin was blocked?"
pin_blocked,en,"can you unblock my account?  i entered the pin wrong."
pin_blocked,en,"my pin needs unblocking, unblock it please?"
pin_blocked,en,"how to unblock my pin?"
pin_blocked,en,"when i was drunk i got my card stuck in your machine because i mis-typed my pin. what do i need to do to get it restored?"
pin_blocked,en,"can i unblock my pin using the app?"
receiving_money,en,"how do i transfer funds if i am paid in gbp?"
receiving_money,en,"how do i know what my account is set to, i am paid in gbp?"
receiving_money,en,"i would like to know how my friend would be able to send me money"
receiving_money,en,"am i allowed to use different currencies?"
receiving_money,en,"i want to get my salary deposited as pesos?"
receiving_money,en,"i received a transfer in gbp how do i change it to a different currency?"
receiving_money,en,"how can my boss pay me directly to the card?"
receiving_money,en,"my salary comes in gbp can i change my options somewhere?"
receiving_money,en,"can my husband open an account and transfer money"
receiving_money,en,"how can you transfer my salary to my correct currency?"
request_refund,en,"tell me how to get a refund for something i bought."
request_refund,en,"my statement has a charge that shouldn't have been made."
request_refund,en,"i need to cancel a purchase?"
request_refund,en,"how do i get a refund for something i bought?"
request_refund,en,"it has been forever ago that i made an order online. the product simply is not coming. just give me back my money because i'm not paying these people."
request_refund,en,"can i get a refund on an item?"
request_refund,en,"how do i get a refund for an item i bought?"
request_refund,en,"i ordered online weeks ago and i never received my package in the mail and i don't want to wait any more. so if i could get my money back now that would be great."
request_refund,en,"i need my purchase cancelled."
request_refund,en,"hello. how do i go about getting a refund of an item i bought ? i want to cancel the payment since i have not received the item yet."
reverted_card_payment?,en,"what happens if my card payment is cancelled?"
reverted_card_payment?,en,"my card payment was reverted"
reverted_card_payment?,en,"what is the reason for my card payment to be reverted?"
reverted_card_payment?,en,"hey a seller just contacted me that my money didn't come through. it was definitely deducted from my account, but now it appears it's back with me! sort this out asap please."
reverted_card_payment?,en,"i just got refunded for my purchase over two weeks ago"
reverted_card_payment?,en,"why would a merchant refuse a payment"
reverted_card_payment?,en,"i think my card payment has been refunded"
reverted_card_payment?,en,"i seem to have a problem here, i bought something about a 2 weeks ago and just now received the payment back into my account and i've already received the item. can you tell me what is going on here?"
reverted_card_payment?,en,"ive been trying to use my card for two weeks now to purchase somethings online but nothing is going through. it keeps returning my payment to my account. there shouldn't be anything wrong with my account, is it the card?"
reverted_card_payment?,en,"i noticed my card payment was cancelled, can you tell me why?"
supported_cards_and_currencies,en,"how can i add money from my amex card"
supported_cards_and_currencies,en,"can i use american express?"
supported_cards_and_currencies,en,"which cards and currencies are supported?"
supported_cards_and_currencies,en,"can you tell me what cards and currencies you support?"
supported_cards_and_currencies,en,"what forms of payment do you accept?"
supported_cards_and_currencies,en,"i wish to use my american express to put funds into my account."
supported_cards_and_currencies,en,"will my other us credit card be accepted?"
supported_cards_and_currencies,en,"what payment methods are used to top up?"
supported_cards_and_currencies,en,"what cards do you accept to top up my account?"
supported_cards_and_currencies,en,"what kind of cards an currency do you support?"
terminate_account,en,"i'm not happy, i want to close my account."
terminate_account,en,"please delete my account and personal information."
terminate_account,en,"the service here is horrible, i want to delete my account."
terminate_account,en,"please delete account"
terminate_account,en,"i need to close my account.  your company is terrible!"
terminate_account,en,"how do i discontinue my account?"
terminate_account,en,"i am very dissatisfied with the services that you are providing.  i want to cancel my account."
terminate_account,en,"i'd like to delete my account."
terminate_account,en,"i no longer want this account, what should i do?"
terminate_account,en,"i want to delete my account. how do i do this?"
top_up_by_bank_transfer_charge,en,"i want to do a swift transfer"
top_up_by_bank_transfer_charge,en,"is there a charge for transfers?"
top_up_by_bank_transfer_charge,en,"is a swift transfer acceptable?"
top_up_by_bank_transfer_charge,en,"what would i be charged in receiving a sepa transfer?"
top_up_by_bank_transfer_charge,en,"do i get charged if i am receiving money?"
top_up_by_bank_transfer_charge,en,"if someone sends me money, will i be charged?"
top_up_by_bank_transfer_charge,en,"what kind of fee is there to top-up my account?"
top_up_by_bank_transfer_charge,en,"am i going to be charged for topping up by transfer?"
top_up_by_bank_transfer_charge,en,"is there a top up fee for transfer?"
top_up_by_bank_transfer_charge,en,"am i able to do a swift transfer with you?"
top_up_by_card_charge,en,"are there any fees if i want to add money using an international card?"
top_up_by_card_charge,en,"is there a charge for topping up by card?"
top_up_by_card_charge,en,"how much does top up fees cost?"
top_up_by_card_charge,en,"will you assess me more fees if i top up with an international card?"
top_up_by_card_charge,en,"where can i top my card for free?"
top_up_by_card_charge,en,"if i top up using a european card is there a charge?"
top_up_by_card_charge,en,"will i be charged a fee for topping up using a european card?"
top_up_by_card_charge,en,"what is the fee for topping up by card?"
top_up_by_card_charge,en,"do i have to pay extra if i use an international card to top up my account?"
top_up_by_card_charge,en,"will there be extra charges regarding to adding money into my international card?"
top_up_by_cash_or_cheque,en,"i want to top up by cheque"
top_up_by_cash_or_cheque,en,"where is the option to top up with a cheque?"
top_up_by_cash_or_cheque,en,"where can i find top up by cash deposit?"
top_up_by_cash_or_cheque,en,"i want to use cash to top up."
top_up_by_cash_or_cheque,en,"is there somewhere i can send a check to add to my account?"
top_up_by_cash_or_cheque,en,"can you tell me where to find top up by cash deposit?"
top_up_by_cash_or_cheque,en,"can i top up my balance with a cheque?"
top_up_by_cash_or_cheque,en,"where's the button to top up with a cheque?"
top_up_by_cash_or_cheque,en,"can i cash deposit to top up my account"
top_up_by_cash_or_cheque,en,"can i top-up by cheque?"
top_up_failed,en,"why is my top up failing"
top_up_failed,en,"i tried to top up my account and it didn't work"
top_up_failed,en,"the top-up did not go through."
top_up_failed,en,"could you please recommend what i should do if my card keeps getting declined?  i planned to top-up today but i am unable to get it to work.  i need a fast solution to this problem."
top_up_failed,en,"i was trying to top-up and my credit card was declined. can you tell me why?"
top_up_failed,en,"i could not get a top-up to work, why?"
top_up_failed,en,"hello, there was an error while attempting top-up with my card this morning. i was able to use the card two days ago with no issues. could you please assist?"
top_up_failed,en,"my top-up was rejected by an app."
top_up_failed,en,"i really need to top-up my card today urgently but my card keeps getting declined!! can you please resolve this problem or try an alternative"
top_up_failed,en,"my top-up didn't go through"
top_up_limits,en,"is there a limit on how much i can top up?"
top_up_limits,en,"what is the max amount of top-ups?"
top_up_limits,en,"is the top-up amount unlimited?"
top_up_limits,en,"can i use as many top-ups as i want?"
top_up_limits,en,"is there a maximum for top-ups?"
top_up_limits,en,"how often am i able to top-up?"
top_up_limits,en,"what's the top-up limit?"
top_up_limits,en,"limits on top ups"
top_up_limits,en,"can i set my own top-up limit?"
top_up_limits,en,"how much is ok for me to top up with?"
top_up_reverted,en,"what should i do?  i topped off but the app reversed  it."
top_up_reverted,en,"my thoughts were that you offered crypto top up which does not seem to be working. the money has now been taken from my account. what is the problem here?"
top_up_reverted,en,"what happened to the money that i deposited?"
top_up_reverted,en,"reverted top up"
top_up_reverted,en,"my money is gone. i had topped up recently and saw it was there and went through, but now it's disappeared, what's going on?"
