Intent Display Name,Language,Phrase
Refund_not_showing_up,en,"i'm supposed to have a refund but it isn't there"
Refund_not_showing_up,en,"as advised by you, i requested seller to refund my money. a week has passed but i haven't got any update from seller. please track the refund with the seller."
Refund_not_showing_up,en,"my refund is not here yet"
Refund_not_showing_up,en,"why cant you just refund me instead of a merchant"
Refund_not_showing_up,en,"i've been waiting for a refund to show up and i don't see it on my statement yet."
Refund_not_showing_up,en,"i have received my statement but i do not see my refund, why is that?"
Refund_not_showing_up,en,"a refund for a recent return has not arrived on my card."
Refund_not_showing_up,en,"i've been checking my statement to see if i've received a refund i requested from a seller a while ago has arrived. but it has not. this should have come back to me already. can you help me figure out why it's not here and get my money back?"
Refund_not_showing_up,en,"where is my refund? it appears to be missing."
Refund_not_showing_up,en,"when will i be able to see the refund"
activate_my_card,en,"what do i need to do for the card activation?"
activate_my_card,en,"how do i activate my card to start using it?"
activate_my_card,en,"i have a new card and need to activate it"
activate_my_card,en,"can someone assist me with activating my new card?"
activate_my_card,en,"how do i turn on my new card?"
activate_my_card,en,"i have a new card and i need to activate it."
activate_my_card,en,"it won't let me activate my card."
activate_my_card,en,"tell me how to renew my new card?"
activate_my_card,en,"my card is not able to be activated how do i get it to work?"
activate_my_card,en,"when are you going to activate my card?"
age_limit,en,"what are age requirements for opening an account?"
age_limit,en,"would i be able to get an account for my child?"
age_limit,en,"how old can one use your service?"
age_limit,en,"can i open up an account for my child?"
age_limit,en,"my son has just turned 13, is he old enough for an account?"
age_limit,en,"what is your age limit?"
age_limit,en,"my daughter needs an acount."
age_limit,en,"is there an age limit for opening an account?"
age_limit,en,"as my kids get older are they able to get set up with their own accounts?"
age_limit,en,"what would the age limit be?"
apple_pay_or_google_pay,en,"why isn't my google pay top up working?"
apple_pay_or_google_pay,en,"can you show me how to top up with google play?"
apple_pay_or_google_pay,en,"how can i top up with google play?"
apple_pay_or_google_pay,en,"i want to top up from my apple watch, can i?"
apple_pay_or_google_pay,en,"is there a way to top up using my apple watch?"
apple_pay_or_google_pay,en,"i got my american express in apple pay, why is top up not working correctly?"
apple_pay_or_google_pay,en,"google pay top up isn't working"
apple_pay_or_google_pay,en,"am i able to top up with apple pay?"
apple_pay_or_google_pay,en,"can i pay for my gas using my apple watch?"
apple_pay_or_google_pay,en,"google pay won't let me top up."
atm_support,en,"where can i withdraw money from?"
atm_support,en,"what is the closest atm?"
atm_support,en,"which atms accept this bill of fare ?"
atm_support,en,"can this card be used at all atms?"
atm_support,en,"tell me what atms take this card."
atm_support,en,"what locations allow me to withdraw money?"
atm_support,en,"tell me what atms use this card."
atm_support,en,"what locations can i get money from?"
atm_support,en,"can i use my card to withdraw from my account?"
atm_support,en,"what atms use this card?"
automatic_top_up,en,"auto-top up option can be found where?"
automatic_top_up,en,"is auto top up available?"
automatic_top_up,en,"can i automatically top-up when traveling?"
automatic_top_up,en,"i heard you have an auto-top up option, where do i find that?"
automatic_top_up,en,"is there a auto top-up option?"
automatic_top_up,en,"where do i access the auto top-up function?"
automatic_top_up,en,"is there a limit to auto top?"
automatic_top_up,en,"how do i get refills to my card when i'm traveling?"
automatic_top_up,en,"how low does the balance have to be before the system updates?"
automatic_top_up,en,"what is the maximum times i can auto top-up?"
balance_not_updated_after_bank_transfer,en,"i completed a transfer that isn't showing up on my account."
balance_not_updated_after_bank_transfer,en,"my transfer has still not appeared."
balance_not_updated_after_bank_transfer,en,"it is common for an international transfer to take 2 days or longer? i made a transfer from france 2 days ago and i have not seen it yet."
balance_not_updated_after_bank_transfer,en,"i added money through a bank transfer and it is not showing in my balance."
balance_not_updated_after_bank_transfer,en,"i made a bank transfer from my uk account today, but it's not showing.  can you check status?"
balance_not_updated_after_bank_transfer,en,"my balance was not updated after transferring money."
balance_not_updated_after_bank_transfer,en,"what amount of time does it take for a transfer to reflect and be available"
balance_not_updated_after_bank_transfer,en,"hello i made a bank account transfer from the uk. the transfer was a couple hours ago, nothing has shown up yet.  can you check to see if everything okay. please."
balance_not_updated_after_bank_transfer,en,"i've transferred money into my account but the balance is the same"
balance_not_updated_after_bank_transfer,en,"what's the time frame normally for a uk account transfer? i just made one and it's not showing up anywhere. i want to be sure that everything is good."
balance_not_updated_after_cheque_or_cash_deposit,en,"my balance doesn't show my deposit."
balance_not_updated_after_cheque_or_cash_deposit,en,"my account balance doesn't reflect an update i made by cheque yesterday. is something wrong or is the system slow?"
balance_not_updated_after_cheque_or_cash_deposit,en,"where is my missing cheque i deposited?"
balance_not_updated_after_cheque_or_cash_deposit,en,"i sent you a cheque a few days ago and i noticed that nothing has happened yet. can you tell me the status of my cheque please?"
balance_not_updated_after_cheque_or_cash_deposit,en,"i have yet to receive the cash i added to my account this morning."
balance_not_updated_after_cheque_or_cash_deposit,en,"my cash deposit from a week ago is still not in my account. can you help me please?"
balance_not_updated_after_cheque_or_cash_deposit,en,"why hasn't my account updated?"
balance_not_updated_after_cheque_or_cash_deposit,en,"i deposited a cheque but the cash hasn't arrived yet"
balance_not_updated_after_cheque_or_cash_deposit,en,"i need my account checked because it appears there is a problem. i attempted to update my balance yesterday using cheque but it doesn't seem to have worked.  should this not be faster than this?"
balance_not_updated_after_cheque_or_cash_deposit,en,"i deposited some cash but it hasn't shown up in my account yet, what's going on?"
beneficiary_not_allowed,en,"my transfer to a beneficiary was rejected."
beneficiary_not_allowed,en,"why couldn't i transfer to a beneficiairy?"
beneficiary_not_allowed,en,"my beneficiary didn't receive my transfer"
beneficiary_not_allowed,en,"it shows that the transfer on my account wasn't allowed."
beneficiary_not_allowed,en,"i'm trying to purchase crypto via the app. i haven't been able to get it to go through. am i doing something wrong?"
beneficiary_not_allowed,en,"why am i not allowed to add a certain beneficiary?"
beneficiary_not_allowed,en,"why is my beneficiary not being allowed to get payment services?"
beneficiary_not_allowed,en,"i tried to transfer cryptocurrency into my account but was denied"
beneficiary_not_allowed,en,"why was i denied the option to transfer money to a selected beneficiary?"
beneficiary_not_allowed,en,"my transfer to an account failed."
cancel_transfer,en,"cancelling a transaction"
cancel_transfer,en,"if i make a mistake can i cancel the transaction?"
cancel_transfer,en,"my morning transaction needs to be canceled."
cancel_transfer,en,"i want to reverse a transaction i did this morning"
cancel_transfer,en,"i made a mistake this morning when i did a transfer. how do i reverse it?"
cancel_transfer,en,"please help revert my transaction from this morning."
cancel_transfer,en,"a payment i made is for a wrong amount can you help me correct the mistake."
cancel_transfer,en,"i need to cancel a transfer i made."
cancel_transfer,en,"i want to revert this mornings transaction."
cancel_transfer,en,"cancel a transaction"
card_about_to_expire,en,"i need a new card, my old card is expiring."
card_about_to_expire,en,"can i wait for you to send me a new card when mine's about to expire?"
card_about_to_expire,en,"how do i get a new expiration date?"
card_about_to_expire,en,"my card is expiring soon."
card_about_to_expire,en,"is it possible to get a new card in china?"
card_about_to_expire,en,"my card expires very soon.  what is the cost and delivery time to get a new one?"
card_about_to_expire,en,"my card is about to expire.  where do i get a new one."
card_about_to_expire,en,"how do i know when my card will expire?"
card_about_to_expire,en,"what do i do after my card expires?"
card_about_to_expire,en,"how do i replace my card?"
card_acceptance,en,"where do i pay with my debit or credit card?"
card_acceptance,en,"can i pay online with my card?"
card_acceptance,en,"which establishments will accept my card?"
card_acceptance,en,"where do i pay with my card?"
card_acceptance,en,"where can i use my card to pay?"
card_acceptance,en,"are there any restrictions on where i use this card?"
card_acceptance,en,"where can my card be used?"
card_acceptance,en,"are there any restrictions to where i can use my card?"
card_acceptance,en,"where is this card accepted?"
card_acceptance,en,"where can i use this card?"
card_arrival,en,"what is the expected delivery date of my card?"
card_arrival,en,"how can i periodically check the delivery of the card you sent?"
card_arrival,en,"how can i track my card's delivery?"
card_arrival,en,"my new card hasn't came in."
card_arrival,en,"is there a reason my new card hasn't arrived?"
card_arrival,en,"can you please tell me where my card is? i ordered it 2 weeks ago!"
card_arrival,en,"why have i not gotten my new card?"
card_arrival,en,"what is the solution of this problem"
card_arrival,en,"i know i'm getting a new card but would like know when i can expect to receive it."
card_arrival,en,"can i track the card that was just sent to me?"
card_delivery_estimate,en,"how long does it take for a card to arrive?"
card_delivery_estimate,en,"how long are deliveries to the us?"
card_delivery_estimate,en,"how long will it take to get to the us?"
card_delivery_estimate,en,"how long will it take to deliver to the us?"
card_delivery_estimate,en,"when can i expect my new card to get here?"
card_delivery_estimate,en,"my card is needed soon"
card_delivery_estimate,en,"what is the length of time for one of these items to come to the u.s?"
card_delivery_estimate,en,"how will i get my card?"
card_delivery_estimate,en,"can the delivery be specific to my needs?"
card_delivery_estimate,en,"are the delivery days flexible?  my schedule only allows me to be a available on specific dates."
card_linking,en,"how do i get the card linked"
card_linking,en,"in the app, how can i make it show the new card that arrived?"
card_linking,en,"how do i link the new card?"
card_linking,en,"how do i add an existing card to the app?"
card_linking,en,"how do i reactivate a card i thought i lost?"
card_linking,en,"how do i link the new card that i just got from you guys?"
card_linking,en,"i found my card that i thought i had lost, i need to reactive it, please help."
card_linking,en,"how do i add my card to the app once i get it?"
card_linking,en,"where do i go to get my new card linked?"
card_linking,en,"i got a new card, how do i link it?"
card_not_working,en,"what is the main reason of this problem"
card_not_working,en,"out of the blue, my card stopped working."
card_not_working,en,"i am unable to use my card."
card_not_working,en,"suddenly, my card won't work."
card_not_working,en,"the card that i have isn't working. this is the physical card."
card_not_working,en,"currently i can't get my card to work."
card_not_working,en,"i can't use my card because it is not working."
card_not_working,en,"i can't get the card itself to work."
card_not_working,en,"i don't know what's wrong with my card, but it has not worked at multiple places today."
card_not_working,en,"how can it be that my card is not functioning anymore?"
card_payment_fee_charged,en,"please explain the extra fee when i paid with the card."
card_payment_fee_charged,en,"i made a purchase with my card and i was charged a fee for using it"
card_payment_fee_charged,en,"i was charged an extra fee for a card payment. i was unaware of these fees beforehand."
card_payment_fee_charged,en,"why is there a charged fee for debit or credit card payment?"
card_payment_fee_charged,en,"why was the price higher when i paid with my card?"
card_payment_fee_charged,en,"i am getting charged fees on some payments.  please help me understand, where are these fees disclosed?"
card_payment_fee_charged,en,"i have a fee and i don't know why"
card_payment_fee_charged,en,"how do i know which payments i make will have additional fees? where can i find this information online?"
card_payment_fee_charged,en,"i paid with card and was charged a fee that shouldn't be there!"
card_payment_fee_charged,en,"there was an extra fee when i paid with my card, why was i charged this extra fee?"
card_payment_not_recognised,en,"i'm worried that my card has been compromised because i see a payment that i didn't make."
card_payment_not_recognised,en,"i didn't make a payment that shows in my app."
card_payment_not_recognised,en,"someone else accessed my account and made a payment."
card_payment_not_recognised,en,"i have a confusing payment appear on my statement and i don't recognise it!"
card_payment_not_recognised,en,"i just saw some charges on my card from the past days that i dont recognize, i need to freeze the card asap! will i be able to get my money back?"
card_payment_not_recognised,en,"i'm noticing a payment/purchase at a company that i don't recognise."
card_payment_not_recognised,en,"i have a card payment that i don't recognize. what should i do?"
card_payment_not_recognised,en,"someone might have access to my card!  there are some strange payments showing up on my account.  what do i do?"
card_payment_not_recognised,en,"i think that there is a payment on my card that i did not authorize.  i don't recognize the name attached to the transaction."
card_payment_not_recognised,en,"i'm checking the app and i see a payment that's not mine."
card_payment_wrong_exchange_rate,en,"it looks like the exchange rates on my card payment are wrong"
card_payment_wrong_exchange_rate,en,"i think the currency exchange that's been applied is wrong."
card_payment_wrong_exchange_rate,en,"something is wrong with my exchange rate charge"
card_payment_wrong_exchange_rate,en,"my rate of exchange was wrong."
card_payment_wrong_exchange_rate,en,"i bought an item and the exchange rate was wrong."
card_payment_wrong_exchange_rate,en,"i  have been charged more than i should for the presents i bought  when abroad, the problem seems to be the exchange rate."
card_payment_wrong_exchange_rate,en,"your exchange rate was off.  i was charged extra on my payment that i made last saturday."
card_payment_wrong_exchange_rate,en,"i think i was charged extra on my payment on last saturday.  maybe the exchange rate was wrong?  i'd like a refund."
card_payment_wrong_exchange_rate,en,"the exchange rate was incorrect for this item i bought."
card_payment_wrong_exchange_rate,en,"i have been charged to much for the object i bought when abroad, the exchange rate seems to be wrong."
card_swallowed,en,"my card is stuck in the atm?"
card_swallowed,en,"the atm didnt return my card!"
card_swallowed,en,"my card is stuck inside the atm, what am i supposed to do?"
card_swallowed,en,"how do i get a new card as your machine swallowed mine!"
card_swallowed,en,"an atm machine didn't give me back my card."
card_swallowed,en,"what do i do if i can't get my card out of the atm?"
card_swallowed,en,"i didn't get my card back from the atm."
card_swallowed,en,"what do i do?  the atm took my card!"
card_swallowed,en,"the atm sucked my card in."
card_swallowed,en,"please send a new card; the atm ate mine."
cash_withdrawal_charge,en,"why did they take more money out then i withdrawed?"
cash_withdrawal_charge,en,"i have a strange transaction on my account which appears to pertain to a cash withdrawal i made outside nandos in leeds.  what is that for?  is it fraud?"
cash_withdrawal_charge,en,"why are you charging for cash withdrawals? i went to withdraw some money earlier today after getting my groceries, and it appears there is a fee that wasn't there before"
cash_withdrawal_charge,en,"could you explain your rules for atm fees?"
cash_withdrawal_charge,en,"is there an extra fee for using an atm?"
cash_withdrawal_charge,en,"what is this extra charge for a withdrawal?"
cash_withdrawal_charge,en,"why am i being charged for withdrawing cash but haven't in the past?"
cash_withdrawal_charge,en,"why was i charged a fee on a cash withdrawal?"
cash_withdrawal_charge,en,"do cash withdrawals cost anything?"
cash_withdrawal_charge,en,"it seems i've suddenly been charged for my recent atm cash withdrawal. what's up with that? i though withdrawals are free, you never charged me so far!"
cash_withdrawal_not_recognised,en,"the app says i made a cash withdrawal that i didn't make"
cash_withdrawal_not_recognised,en,"there's a cash withdrawal on my account that i didn't make"
cash_withdrawal_not_recognised,en,"please help me, its urgent. someone has withdrawn money from my account as few hours before my wallet has been. now i want to stop withdrawal of more money."
cash_withdrawal_not_recognised,en,"the app says i made a cash withdrawal even though i didn't."
cash_withdrawal_not_recognised,en,"how do i report a cash withdrawal that wasn't me?"
cash_withdrawal_not_recognised,en,"the app says i got cash from an atm but i didn't"
cash_withdrawal_not_recognised,en,"a wd was just made on my account, but it was not me and i still have my card.  what to do?"
cash_withdrawal_not_recognised,en,"i noticed that there is a withdrawal in the app that is not mine."
cash_withdrawal_not_recognised,en,"somebody made a withdrawal from my account for 500. i have my card so how can this be? does somebody have a duplicate card or something? help please."
cash_withdrawal_not_recognised,en,"i am seeing in the app, some cash witdhrawals that i did not authorize."
change_pin,en,"do you know how to change my card pin?"
change_pin,en,"is going to a bank only way to change my pin?"
change_pin,en,"can i change my pin?"
change_pin,en,"can i change my pin at a nearby atm when in spain? i think someone saw my pin and i need to change it but am on vacation."
change_pin,en,"can you tell me what i need to do to have my pin changed?"
change_pin,en,"how can i change my old pin to a new one?"
change_pin,en,"can i change my pin on my phone?"
change_pin,en,"how can i set a new pin."
change_pin,en,"do i need to speak to a representative to change my pin?"
change_pin,en,"i want to create a new pin."
compromised_card,en,"i noticed my card was used in a small town that i have never been to. can you stop the card from being used more?"
compromised_card,en,"i think my card has been used by somebody else since i was never in the little town where some transactions on this bill have come from. please stop this right away."
compromised_card,en,"i believe that someone is using my card without my knowledge!"
compromised_card,en,"someone might have had access to my card."
compromised_card,en,"how do i report possible fraudulent activity on my account?"
compromised_card,en,"questionable transactions on my account."
compromised_card,en,"my card must have used my card as there are some transactions that i haven't done myself.."
compromised_card,en,"there are transactions that i did not make on my account, i think someone has my information."
compromised_card,en,"someone has been using my card. there are unfamiliar transactions on there. can you freeze the card to keep this from happening?"
compromised_card,en,"i might be paranoid, but someone may be using my card."
contactless_not_working,en,"i've tried using my contactless in several locations today and it's not working anywhere. it seemed fine before. how do i get it to work again?"
contactless_not_working,en,"how come when i tried to pay contactless at the bus it didnt work?"
contactless_not_working,en,"help me to set up contactless payments."
contactless_not_working,en,"my contactless is non-functional."
contactless_not_working,en,"how can i fix my contactless?"
contactless_not_working,en,"what do i have to do to get the contactless to work?"
contactless_not_working,en,"any charges applicable for new card?"
contactless_not_working,en,"how do i troubleshoot my contactless?"
contactless_not_working,en,"i was trying to use contactless earlier, but it didn't work."
contactless_not_working,en,"my contactless payments don't work."
country_support,en,"you provide support in what countries?"
country_support,en,"are your cards available in the eu?"
country_support,en,"you operate in which countries?"
country_support,en,"what countries have access to this service."
country_support,en,"can i get a card that works in other countries like africa and indonesia?"
country_support,en,"do you provide cards to people not in the uk?"
country_support,en,"is this card available to united states residents?"
country_support,en,"what countries are you issuing cards for?"
country_support,en,"which countries do you support?"
country_support,en,"is it possible to get one the your cards in the eu?"
declined_card_payment,en,"can you tell me why my card payment did not work?"
declined_card_payment,en,"for some reason my card payment hasn't worked. what can i do to look into that?"
declined_card_payment,en,"i had a card payment that was declined.  why?"
declined_card_payment,en,"my payment was rejected"
declined_card_payment,en,"can you tell me why my card keeps getting declined every time i try to use it?"
declined_card_payment,en,"my card is not working at stores."
declined_card_payment,en,"why is it saying my card payment is declined when i made it?"
declined_card_payment,en,"my payment for my card is not working"
declined_card_payment,en,"why do you keep declining my payment?i tried several times with this card and it is just not working."
declined_card_payment,en,"i have enough money in my account, so why is my card being declined?"
declined_cash_withdrawal,en,"i could not get the atm to work"
declined_cash_withdrawal,en,"my card has been declined by two separate atm, and i'm worried something is wrong with my account. would you please see if my account is okay?"
declined_cash_withdrawal,en,"i think i am having an issue with withdraws on my card. it was declined on the way to work this morning. this hasn't happened in the past."
declined_cash_withdrawal,en,"why couldn't i get cash from an atm?"
declined_cash_withdrawal,en,"i tried to withdraw cash from the atm machine and it did not work. can you tell me why?"
declined_cash_withdrawal,en,"why can't i withdraw cash?"
declined_cash_withdrawal,en,"the atm machines keep declining my card and i don't know why. i thought i had money in my account. why is this happening?"
declined_cash_withdrawal,en,"when going to the atm to take out some cash today my withdrawal was  declined.  i need to fix this problem as soon as possible. whats going on?"
declined_cash_withdrawal,en,"is there something wrong with the atm? it would not let me pull cash out of my account."
declined_cash_withdrawal,en,"when i tried to access my cash, i wasn't allowed!"
declined_transfer,en,"transfer unable to be completed, states 'declined'"
declined_transfer,en,"why did you decline my transfer?"
declined_transfer,en,"why was one of my transfers declined?"
declined_transfer,en,"i have been doing some online shopping, but when checking out, it keeps getting declined. i tried a few times and it wouldn't work. what could be wrong?"
declined_transfer,en,"what would be a reason my transfer got declined?"
declined_transfer,en,"how can i find a way to transfer money without it being rejected?"
declined_transfer,en,"i have a transfer that was declined."
declined_transfer,en,"why do you keep declining my transfers? it's been working well so far, but when i just tried to buy something, the card got declined. i tried it a few times, but same thing happened every try."
declined_transfer,en,"can you tell me why my transfer declined?"
declined_transfer,en,"declined, transfer not completed."
direct_debit_payment_not_recognised,en,"i need to cancel a transaction on my debit card."
direct_debit_payment_not_recognised,en,"is there a strict timeline regarding disputing transactions made on my account? i just noticed a fraudulent charge on a statement from a couple months ago."
direct_debit_payment_not_recognised,en,"i need a refund on a direct debit that shows in the app because i did not make it."
direct_debit_payment_not_recognised,en,"there was a charge made on my card from a couple weeks ago and i don't remember making the purchase. nor do i remember the company itself. can we trace this at all to confirm if i did it or not?"
direct_debit_payment_not_recognised,en,"my statement shows a strange direct debit."
direct_debit_payment_not_recognised,en,"there is a debit transaction on my statement that i did not make"
